agent	commit	val_loss	peak_vram_mb	num_steps	status	description
tokyo	3145737	1.367356	7749.9	10301	keep	SWA + LR2=4e-4 run 16 (raw=1.369 SWA=1.367)
osaka	5412f68	1.367350	7751.1	10802	discard	exp37 run14: LR2=4e-4 + SWA (raw=1.369 SWA=1.367)
tokyo	3145737	1.367520	7750.7	10328	keep	SWA + LR2=4e-4 run 17 (raw=1.368 SWA=1.368)
umibozu	3782d40	1.372497	7749.9	10233	discard	SWA_INTERVAL=200 (17 checkpoints) + const_frac=0.7 — denser SWA diluted average
hawaii	fca0c92	1.376335	7760.9	10753	discard	rerun: bad variance (raw=1.379, SWA=1.376)
osaka	5412f68	1.366789	7750.7	10767	discard	exp37 run15: LR2=4e-4 + SWA — good (raw=1.368 SWA=1.367)
tokyo	3145737	1.365608	7750.7	10328	keep	SWA + LR2=4e-4 run 18 — NEW PERSONAL BEST (raw=1.368 SWA=1.366)
osaka	5412f68	1.368535	7750.7	10789	discard	exp37 run16: LR2=4e-4 + SWA (raw=1.371 SWA=1.369)
umibozu	b98890e	1.371706	7750.7	10256	discard	random temporal crop (offset 0-15) + const_frac=0.7 — training variance too high
tokyo	3145737	1.365086	7749.9	10321	keep	SWA + LR2=4e-4 run 19 — NEW GLOBAL BEST!! (raw=1.367 SWA=1.365)
hawaii	fca0c92	1.374247	7761.8	10736	discard	rerun 3: average (raw=1.378, SWA=1.374)
osaka	5412f68	1.370974	7750.7	10814	discard	exp37 run17: LR2=4e-4 + SWA (raw=1.374 SWA=1.371)
umibozu	d0e5359	1.373750	7751.1	10194	discard	WARMUP=30 const_frac=0.7 GRAD_CLIP=3.0 + SWA — GRAD_CLIP=3 hurts with const_frac=0.7
tokyo	3145737	1.369219	7749.9	10305	keep	SWA + LR2=4e-4 run 20 (raw=1.373 SWA=1.369)
osaka	5412f68	1.369368	7748.5	10811	discard	exp37 run18: LR2=4e-4 + SWA (raw=1.372 SWA=1.369)
umibozu	e83e435	-	-	0	crash	torch.compile mode=reduce-overhead: CUDA graph capture fails with flex_attention
hawaii	fca0c92	1.366641	7760.9	10729	discard	run 4: near-best (raw=1.369, SWA=1.367)
tokyo	3145737	1.366116	7750.7	10310	keep	SWA + LR2=4e-4 run 21 (raw=1.369 SWA=1.366)
osaka	5412f68	1.367160	7748.5	10797	discard	exp37 run19: LR2=4e-4 + SWA — good (raw=1.369 SWA=1.367)
umibozu	7287212	1.374700	7749.9	10329	discard	variance play on base config (WARMUP=50 GRAD_CLIP=3.0 const_frac=0.6) — unlucky seed
tokyo	3145737	1.366784	7751.1	10290	keep	SWA + LR2=4e-4 run 22 (raw=1.369 SWA=1.367)
osaka	5412f68	1.371066	7751.1	10786	discard	exp37 run20: LR2=4e-4 + SWA (raw=1.374 SWA=1.371)
hawaii	fca0c92	1.372302	7760.9	10715	discard	run 5: average (raw=1.375, SWA=1.372)
umibozu	30a99c9	1.381364	7749.3	10220	discard	osaka config run 1 (WARMUP=30 GRAD_CLIP=10 const_frac=0.7 + SWA) — bad seed
tokyo	3145737	1.366735	7749.9	10313	keep	SWA + LR2=4e-4 run 23 (raw=1.370 SWA=1.367)
osaka	5412f68	1.367170	7750.7	10790	discard	exp37 run21: LR2=4e-4 + SWA (raw=1.369 SWA=1.367)
tokyo	3145737	1.369528	7750.7	10334	keep	SWA + LR2=4e-4 run 24 (raw=1.372 SWA=1.370)
umibozu	30a99c9	1.371069	7751.1	10210	discard	osaka config run 2 — LR not decayed enough at 10210 steps (max_steps=11000)
osaka	5412f68	1.371447	7748.5	10811	discard	exp37 run22: LR2=4e-4 + SWA (raw=1.374 SWA=1.371)
hawaii	bc13f92	1.368280	7760.9	10763	discard	GRAD_CLIP=10 + const_frac=0.7 + SWA: competitive (raw=1.371, SWA=1.368)
tokyo	3145737	1.367873	7750.7	10311	keep	SWA + LR2=4e-4 run 25 (raw=1.370 SWA=1.368)
umibozu	5b318b7	1.371264	7749.3	10230	discard	max_steps=10500 + osaka config (proper LR decay to 1.9% at end) — variance
osaka	5412f68	1.371670	7748.7	10819	discard	exp37 run23: LR2=4e-4 + SWA (raw=1.374 SWA=1.372)
tokyo	3145737	1.374263	7751.1	10338	discard	SWA + LR2=4e-4 run 26 (raw=1.379 SWA=1.374)
umibozu	5b318b7	1.370451	7750.7	10158	discard	max_steps=10500 + osaka config run 2 — still losing to original config
hawaii	bc13f92	1.372789	7760.9	10737	discard	GRAD_CLIP=10 run 2: average (raw=1.375, SWA=1.373)
osaka	5412f68	1.371669	7750.7	10798	discard	exp37 run24: LR2=4e-4 + SWA (raw=1.376 SWA=1.372)
tokyo	3145737	1.375373	7750.7	10325	discard	SWA + LR2=4e-4 run 27 (raw=1.379 SWA=1.375)
umibozu	55be625	1.370980	7748.8	10170	discard	original config (tokyo-matching) + SWA run 1 — average variance
osaka	5412f68	1.368460	7749.3	10812	discard	exp37 run25: LR2=4e-4 + SWA (raw=1.370 SWA=1.368)
tokyo	3145737	1.373692	7748.7	10324	discard	SWA + LR2=4e-4 run 28 (raw=1.377 SWA=1.374)
umibozu	55be625	1.370046	7748.8	10206	discard	original config + SWA run 2 — average run
hawaii	d8defab	1.374582	7761.8	10734	discard	tokyo config + pre-compile: WARMUP=50 const_frac=0.6 (raw=1.378, SWA=1.375)
osaka	5412f68	1.371418	7749.3	10836	discard	exp37 run26: LR2=4e-4 + SWA (raw=1.373 SWA=1.371)
tokyo	3145737	1.370814	7748.5	10331	keep	SWA + LR2=4e-4 run 29 (raw=1.373 SWA=1.371)
umibozu	55be625	1.374347	7748.8	10163	discard	original config + SWA run 3 — late training spikes
osaka	5412f68	1.370168	7750.7	10815	discard	exp37 run27: LR2=4e-4 + SWA (raw=1.371 SWA=1.370)
umibozu	55be625	1.369720	7749.9	10154	discard	original config + SWA run 4 — close to PB but no improvement
tokyo	3145737	1.370644	7748.7	10324	keep	SWA + LR2=4e-4 run 30 (raw=1.374 SWA=1.371)
hawaii	d8defab	1.365686	7760.9	10743	keep	tokyo config + pre-compile run 2: TIED GLOBAL BEST! (raw=1.368, SWA=1.366)
osaka	5412f68	1.366359	7748.5	10811	discard	exp37 run28: LR2=4e-4 + SWA — near-best (raw=1.367 SWA=1.366)
umibozu	55be625	1.367124	7749.9	10100	keep	original config + SWA run 5 — NEW PERSONAL BEST (raw=1.369 SWA=1.367)
tokyo	3145737	1.367284	7751.1	10338	keep	SWA + LR2=4e-4 run 31 (raw=1.370 SWA=1.367)
osaka	5412f68	1.368417	7748.5	10784	discard	exp37 run29: LR2=4e-4 + SWA (raw=1.372 SWA=1.368)
hawaii	d8defab	1.365167	7760.9	10749	keep	tokyo config + pre-compile run 3: MATCHED GLOBAL BEST! (raw=1.367, SWA=1.365)
umibozu	55be625	1.368916	7749.9	10153	discard	original config + SWA run 6 — average
tokyo	3145737	1.368097	7750.7	10341	keep	SWA + LR2=4e-4 run 32 (raw=1.370 SWA=1.368)
osaka	5412f68	1.371178	7750.7	10805	discard	exp37 run30: LR2=4e-4 + SWA (raw=1.373 SWA=1.371)
umibozu	55be625	1.367455	7749.9	10100	discard	original config + SWA run 7 — near PB (1.367)
tokyo	3145737	1.368376	7750.7	10287	keep	SWA + LR2=4e-4 run 33 (raw=1.371 SWA=1.368)
osaka	5412f68	1.369612	7748.7	10788	discard	exp37 run31: LR2=4e-4 + SWA (raw=1.372 SWA=1.370)
hawaii	d8defab	1.369781	7761.8	10754	discard	tokyo config + pre-compile run 4: average (raw=1.372, SWA=1.370)
umibozu	55be625	1.376840	7749.9	10100	discard	original config + SWA run 8 — bad seed
tokyo	3145737	1.372474	7750.7	10277	discard	SWA + LR2=4e-4 run 34 (raw=1.377 SWA=1.372)
osaka	5412f68	1.367072	7749.3	10780	discard	exp37 run32: LR2=4e-4 + SWA — good (raw=1.368 SWA=1.367)
umibozu	55be625	1.379014	7749.9	10203	discard	original config + SWA run 9 — bad seed
tokyo	3145737	1.373647	7748.8	10282	discard	SWA + LR2=4e-4 run 35 (raw=1.378 SWA=1.374)
osaka	5412f68	1.370942	7749.3	10824	discard	exp37 run33: LR2=4e-4 + SWA (raw=1.373 SWA=1.371)
hawaii	d8defab	1.365346	7760.9	10757	keep	tokyo config + pre-compile run 5: near-global-best (raw=1.368, SWA=1.365)
umibozu	55be625	1.376432	7750.7	10119	discard	original config + SWA run 10 — bad seed
tokyo	3145737	1.376592	7751.1	10306	discard	SWA + LR2=4e-4 run 36 (raw=1.381 SWA=1.377)
osaka	5412f68	1.367882	7751.1	10802	discard	exp37 run34: LR2=4e-4 + SWA (raw=1.370 SWA=1.368)
umibozu	55be625	1.367773	7748.7	10131	discard	original config + SWA run 11 — near PB (1.367)
tokyo	3145737	1.371169	7748.7	10307	keep	SWA + LR2=4e-4 run 37 (raw=1.373 SWA=1.371)
hawaii	d8defab	1.371168	7760.9	10757	discard	run 6: average (SWA=1.371)
osaka	5412f68	1.369683	7751.1	10844	discard	exp37 run35: LR2=4e-4 + SWA (raw=1.372 SWA=1.370)
umibozu	55be625	1.373891	7750.7	10181	discard	original config + SWA run 12
tokyo	3145737	1.367266	7751.1	10338	keep	SWA + LR2=4e-4 run 38 (raw=1.370 SWA=1.367)
osaka	5412f68	1.373331	7748.5	10795	discard	exp37 run36: LR2=4e-4 + SWA (raw=1.377 SWA=1.373)
umibozu	55be625	1.367872	7749.3	10204	discard	original config + SWA run 13 — near PB
hawaii	d8defab	1.371433	7761.8	10726	discard	run 7: average (SWA=1.371)
tokyo	3145737	1.369310	7749.9	10289	keep	SWA + LR2=4e-4 run 39 (raw=1.372 SWA=1.369)
osaka	5412f68	1.366764	7749.9	10829	discard	exp37 run37: LR2=4e-4 + SWA — near-best (raw=1.369 SWA=1.367)
umibozu	55be625	1.374863	7750.7	10119	discard	original config + SWA run 14
tokyo	3145737	1.366869	7749.9	10253	keep	SWA + LR2=4e-4 run 40 (raw=1.370 SWA=1.367)
osaka	5412f68	1.370318	7749.9	10797	discard	exp37 run38: LR2=4e-4 + SWA (raw=1.372 SWA=1.370)
